sme0631100,SME-63.11,SME-63.11 The system shall include the validation in the PR history report.,The system shall include the validation in the PR history report.,Requirement
sme0631200,SME-63.12,SME-63.12 The system shall include the assignment in the PR history report.,The system shall include the assignment in the PR history report.,Requirement
sme0631300,SME-63.13,SME-63.13 The system shall include the consolidation in the PR history report.,The system shall include the consolidation in the PR history report.,Requirement
sme0631400,SME-63.14,SME-63.14 The system shall include the pending approval in the PR history report.,The system shall include the pending approval in the PR history report.,Requirement
sme0631500,SME-63.15,SME-63.15 The system shall include the approval in the PR history report.,The system shall include the approval in the PR history report.,Requirement
sme0631600,SME-63.16,SME-63.16 The system shall include if the PR is on hold in the PR history report.,The system shall include if the PR is on hold in the PR history report.,Requirement
sme0631700,SME-63.17,SME-63.17 The system shall include if the PR is suspended in the PR history report.,The system shall include if the PR is suspended in the PR history report.,Requirement
sme0631800,SME-63.18,SME-63.18 The system shall include if the PR is cancelled in the PR history report.,The system shall include if the PR is cancelled in the PR history report.,Requirement
sme0631900,SME-63.19,SME-63.19 The system shall include if the PR is deleted in the PR history report.,The system shall include if the PR is deleted in the PR history report.,Requirement
sme0640000,SME-64,SME-64 The system shall provide a solicitation history report by document number.,The system shall provide a solicitation history report by document number.,Requirement
sme0640100,SME-64.01,SME-64.01 The system shall include the solicitation in the solicitation history report.,The system shall include the solicitation in the solicitation history report.,Requirement
sme0640200,SME-64.02,SME-64.02 The system shall include changes in status in the solicitation history report.,The system shall include changes in status in the solicitation history report.,Requirement
sme0640300,SME-64.03,SME-64.03 The system shall include the date of status change in the solicitation history report.,The system shall include the date of status change in the solicitation history report.,Requirement
sme0640400,SME-64.04,SME-64.04 The system shall include the assignee or approver’s name that created the status change in the solicitation history report.,The system shall include the assignee or approver’s name that created the status change in the solicitation history report.,Requirement
sme0640500,SME-64.05,SME-64.05 The system shall include the assignee or approver’s organization that created the status change in the solicitation history report.,The system shall include the assignee or approver’s organization that created the status change in the solicitation history report.,Requirement
sme0640600,SME-64.06,SME-64.06 The system shall include solicitations being prepared in the solicitation history report.,The system shall include solicitations being prepared in the solicitation history report.,Requirement
sme0640700,SME-64.07,SME-64.07 The system shall include issued solicitations in the solicitation history report.,The system shall include issued solicitations in the solicitation history report.,Requirement
sme0640800,SME-64.08,SME-64.08 The system shall include active/open solicitations in the solicitation history report.,The system shall include active/open solicitations in the solicitation history report.,Requirement
sme0640900,SME-64.09,SME-64.09 The system shall include solicitations closed for receipt of offer/bids in the solicitation history report.,The system shall include solicitations closed for receipt of offer/bids in the solicitation history report.,Requirement
sme0641000,SME-64.10,SME-64.10 The system shall include solicitations in evaluation in the solicitation history report.,The system shall include solicitations in evaluation in the solicitation history report.,Requirement
sme0641100,SME-64.11,SME-64.11 The system shall include solicitations in evaluation in the solicitation history report.,The system shall include solicitations in evaluation in the solicitation history report.,Requirement
sme0641200,SME-64.12,SME-64.12 The system shall include solicitations under amendment in the solicitation history report.,The system shall include solicitations under amendment in the solicitation history report.,Requirement
sme0641300,SME-64.13,SME-64.13 The system shall include solicitations under protest and stayed in the solicitation history report.,The system shall include solicitations under protest and stayed in the solicitation history report.,Requirement
sme0641400,SME-64.14,SME-64.14 The system shall include solicitations under protest and not stayed in the solicitation history report.,The system shall include solicitations under protest and not stayed in the solicitation history report.,Requirement
sme0641500,SME-64.15,SME-64.15 The system shall include solicitations withdrawn and removed from Contract Opportunities in the solicitation history report.,The system shall include solicitations withdrawn and removed from Contract Opportunities in the solicitation history report.,Requirement
sme0650000,SME-65,SME-65 The system shall provide a contract history report by document number.,The system shall provide a contract history report by document number.,Requirement
sme0650100,SME-65.01,SME-65.01 The system shall include the contract in the contract history report.,The system shall include the contract in the contract history report.,Requirement
sme0650200,SME-65.02,SME-65.02 The system shall include changes in status in the contract history report.,The system shall include changes in status in the contract history report.,Requirement
sme0650300,SME-65.03,SME-65.03 The system shall include the date of status change in the contract history report.,The system shall include the date of status change in the contract history report.,Requirement
sme0650400,SME-65.04,SME-65.04 The system shall include the assignee or approver’s name that created the status change in the contract history report.,The system shall include the assignee or approver’s name that created the status change in the contract history report.,Requirement
sme0650500,SME-65.05,SME-65.05 The system shall include the assignee or approver’s organization that created the status change in the contract history report.,The system shall include the assignee or approver’s organization that created the status change in the contract history report.,Requirement
sme0650600,SME-65.06,SME-65.06 The system shall include contracts being prepared in the contract history report.,The system shall include contracts being prepared in the contract history report.,Requirement
sme0650700,SME-65.07,SME-65.07 The system shall include contracts under protest and stayed in the contract history report.,The system shall include contracts under protest and stayed in the contract history report.,Requirement
sme0650800,SME-65.08,SME-65.08 The system shall include contracts under protest and not stayed in the contract history report.,The system shall include contracts under protest and not stayed in the contract history report.,Requirement
sme0650900,SME-65.09,SME-65.09 The system shall include contracts awarded and active in the contract history report.,The system shall include contracts awarded and active in the contract history report.,Requirement
sme0651000,SME-65.10,SME-65.10 The system shall include contracts under modification in the contract history report.,The system shall include contracts under modification in the contract history report.,Requirement
sme0651100,SME-65.11,SME-65.11 The system shall include contracts partially terminated in the contract history report.,The system shall include contracts partially terminated in the contract history report.,Requirement
sme0651200,SME-65.12,SME-65.12 The system shall include contracts fully terminated in the contract history report.,The system shall include contracts fully terminated in the contract history report.,Requirement
sme0651300,SME-65.13,SME-65.13 The system shall include contracts completed and closed in the contract history report.,The system shall include contracts completed and closed in the contract history report.,Requirement
sme0660000,SME-66,SME-66 The system shall provide by document number a report of the related acquisition document in the document’s processing chain.,The system shall provide by document number a report of the related acquisition document in the document’s processing chain.,Requirement
sme0670000,SME-67,SME-67 The system shall provide a document report.,The system shall provide a document report.,Requirement
sme0670100,SME-67.01,SME-67.01 The system shall provide the document number within the document report.,The system shall provide the document number within the document report.,Requirement
sme0670200,SME-67.02,SME-67.02 The system shall provide the document status within the document report.,The system shall provide the document status within the document report.,Requirement
sme0680000,SME-68,SME-68 The system shall provide the capability to expand or collapse the entire hierarchy of the document number report.,The system shall provide the capability to expand or collapse the entire hierarchy of the document number report.,Requirement
sme0690000,SME-69,SME-69 The system shall provide the capability to search/query a report.,The system shall provide the capability to search/query a report.,Requirement
sme0690100,SME-69.01,SME-69.01 The system shall provide the capability to search/query a report by user name.,The system shall provide the capability to search/query a report by user name.,Requirement
sme0690200,SME-69.02,SME-69.02 The system shall provide the capability to search/query a report by document number.,The system shall provide the capability to search/query a report by document number.,Requirement
sme0690300,SME-69.03,SME-69.03 The system shall provide the capability to search/query a report by document type.,The system shall provide the capability to search/query a report by document type.,Requirement
sme0690400,SME-69.04,SME-69.04 The system shall provide the capability to search/query a report by change type.,The system shall provide the capability to search/query a report by change type.,Requirement
sme0690500,SME-69.05,SME-69.05 The system shall provide the capability to search/query a report by transaction date range.,The system shall provide the capability to search/query a report by transaction date range.,Requirement
sme0690600,SME-69.06,SME-69.06 The system shall provide the capability to search/query a report by period of performance.,The system shall provide the capability to search/query a report by period of performance.,Requirement
sme0690700,SME-69.07,SME-69.07 The system shall provide the capability to search/query a report by data range.,The system shall provide the capability to search/query a report by data range.,Requirement
sme0700000,SME-70,SME-70 The system shall provide the capability to associate PARs with the ECF.,The system shall provide the capability to associate PARs with the ECF.,Requirement
smf0010000,SMF-01,SMF-01 The system shall have a reporting capability.,The system shall have a reporting capability.,Requirement
smf0010100,SMF-01.01,SMF-01.01 The system shall use data collected in near-real time for reporting.,The system shall use data collected in near-real time for reporting.,Requirement
smf0010200,SMF-01.02,SMF-01.02 The system shall provide the capability to create standard reports.,The system shall provide the capability to create standard reports.,Requirement
smf0010300,SMF-01.03,SMF-01.03 The system shall provide the capability to edit standard reports.,The system shall provide the capability to edit standard reports.,Requirement
smf0010400,SMF-01.04,SMF-01.04 The system shall provide the capability to maintain standard reports.,The system shall provide the capability to maintain standard reports.,Requirement
smf0010500,SMF-01.05,SMF-01.05 The system shall provide the capability to schedule standard reports.,The system shall provide the capability to schedule standard reports.,Requirement
smf0010600,SMF-01.06,SMF-01.06 The system shall provide the capability to receive standard reports.,The system shall provide the capability to receive standard reports.,Requirement
smf0010700,SMF-01.07,SMF-01.07 The system shall provide the capability to distribute standard reports.,The system shall provide the capability to distribute standard reports.,Requirement
smf0010800,SMF-01.08,SMF-01.08 The system shall provide the capability to create ad-hoc reports.,The system shall provide the capability to create ad-hoc reports.,Requirement
smf0010900,SMF-01.09,SMF-01.09 The system shall provide the capability to edit ad-hoc reports.,The system shall provide the capability to edit ad-hoc reports.,Requirement
smf0011000,SMF-01.10,SMF-01.10 The system shall provide the capability to maintain ad-hoc reports.,The system shall provide the capability to maintain ad-hoc reports.,Requirement
smf0011100,SMF-01.11,SMF-01.11 The system shall provide the capability to schedule ad-hoc reports.,The system shall provide the capability to schedule ad-hoc reports.,Requirement
smf0011200,SMF-01.12,SMF-01.12 The system shall provide the capability to receive ad-hoc reports.,The system shall provide the capability to receive ad-hoc reports.,Requirement
smf0011300,SMF-01.13,SMF-01.13 The system shall provide the capability to distribute ad-hoc reports.,The system shall provide the capability to distribute ad-hoc reports.,Requirement
smf0020000,SMF-02,SMF-02 The system shall provide the capability to report on any database field.,The system shall provide the capability to report on any database field.,Requirement
smf0030000,SMF-03,SMF-03 The system shall limit the reporting results to the user’s access permissions.,The system shall limit the reporting results to the user’s access permissions.,Requirement
smf0040000,SMF-04,SMF-04 The system shall provide the capability to select data elements by “drilling down” into a functional area (such as PR)/Line Item/POP/POP end date).,The system shall provide the capability to select data elements by “drilling down” into a functional area (such as PR)/Line Item/POP/POP end date).,Requirement
smf0050000,SMF-05,SMF-05 The system shall provide the capability to edit a report using functions that are available during new report creation such as adding columns and filters.,The system shall provide the capability to edit a report using functions that are available during new report creation such as adding columns and filters.,Requirement
smf0060000,SMF-06,SMF-06 The system shall have the capability to maintain the newly-edited report.,The system shall have the capability to maintain the newly-edited report.,Requirement
smf0070000,SMF-07,SMF-07 The system shall provide the capability to store a report.,The system shall provide the capability to store a report.,Requirement
smf0080000,SMF-08,SMF-08 The system shall provide the capability to export report results in multiple formats.,The system shall provide the capability to export report results in multiple formats.,Requirement
smf0080100,SMF-08.01,SMF-08.01 The system shall provide the capability to export report results in Portable Document Format (PDF).,The system shall provide the capability to export report results in Portable Document Format (PDF).,Requirement
smf0080200,SMF-08.02,SMF-08.02 The system shall provide the capability to export report results in Microsoft Excel (XLS) format.,The system shall provide the capability to export report results in Microsoft Excel (XLS) format.,Requirement
smf0080300,SMF-08.03,SMF-08.03 The system shall provide the capability to export report results in Extensible Markup language (XML) format.,The system shall provide the capability to export report results in Extensible Markup language (XML) format.,Requirement
smf0080400,SMF-08.04,SMF-08.04 The system shall provide the capability to export report results in Text-delimited file format.,The system shall provide the capability to export report results in Text-delimited file format.,Requirement
smf0090000,SMF-09,SMF-09 The system shall provide the capability to schedule a report or group of reports at a specified server time.,The system shall provide the capability to schedule a report or group of reports at a specified server time.,Requirement
smf0090100,SMF-09.01,SMF-09.01 The system shall allow the user to select sequential processing of scheduled reports.,The system shall allow the user to select sequential processing of scheduled reports.,Requirement
smf0090200,SMF-09.02,SMF-09.02 The system shall allow the user to select parallel processing of scheduled reports.,The system shall allow the user to select parallel processing of scheduled reports.,Requirement
smf0100000,SMF-10,SMF-10 The system shall provide the capability to share reports across all users.,The system shall provide the capability to share reports across all users.,Requirement
smf0110000,SMF-11,SMF-11 The system shall provide the capability to edit a report received from other users.,The system shall provide the capability to edit a report received from other users.,Requirement
smf0120000,SMF-12,"SMF-12 The system shall provide the capability to consolidate a group of identical reports to generate a single, comprehensive report in order to support enterprise reporting.","The system shall provide the capability to consolidate a group of identical reports to generate a single, comprehensive report in order to support enterprise reporting.",Requirement
smf0130000,SMF-13,SMF-13 The system shall provide the capability to format the printed output of a report.,The system shall provide the capability to format the printed output of a report.,Requirement
smf0140000,SMF-14,SMF-14 The system shall provide the capability to distribute (via email) a report.,The system shall provide the capability to distribute (via email) a report.,Requirement
smf0150000,SMF-15,SMF-15 The system shall provide the capability to distribute (via email) a report as part of the report scheduling capability.,The system shall provide the capability to distribute (via email) a report as part of the report scheduling capability.,Requirement
smf0160000,SMF-16,SMF-16 The system shall provide the capability for a user to view multiple reports concurrently.,The system shall provide the capability for a user to view multiple reports concurrently.,Requirement
smf0170000,SMF-17,SMF-17 The system shall provide the capability to generate an error in the event a report cannot generate.,The system shall provide the capability to generate an error in the event a report cannot generate.,Requirement
smf0180000,SMF-18,SMF-18 The system shall provide the capability to generate a “Workload In-Progress” report for all PRs that have not been approved.,The system shall provide the capability to generate a “Workload In-Progress” report for all PRs that have not been approved.,Requirement
smf0190000,SMF-19,SMF-19 The system shall provide the capability to generate a task assignment report for one or more users or groups.,The system shall provide the capability to generate a task assignment report for one or more users or groups.,Requirement
smf0200000,SMF-20,SMF-20 The system shall provide the capability to generate a financial summary report to facilitate budgeting processes by identifying executed and non-executed funds during a specified timeframe.,The system shall provide the capability to generate a financial summary report to facilitate budgeting processes by identifying executed and non-executed funds during a specified timeframe.,Requirement
smf0210000,SMF-21,SMF-21 The system shall provide the capability to generate a security model report to demonstrate the current configuration of the system.,The system shall provide the capability to generate a security model report to demonstrate the current configuration of the system.,Requirement
smf0220000,SMF-22,SMF-22 The system shall provide the capability to generate a periodic data extract to support the Freedom of Information Act (FOIA).,The system shall provide the capability to generate a periodic data extract to support the Freedom of Information Act (FOIA).,Requirement
smf0230000,SMF-23,SMF-23 The system shall provide the capability to generate an error report to identify attempted security violations and functional errors during a specified timeframe.,The system shall provide the capability to generate an error report to identify attempted security violations and functional errors during a specified timeframe.,Requirement
smf0240000,SMF-24,SMF-24 The system shall provide the capability to generate a contract expirations report to identify the conclusion of activities such as POP end dates for a given timeframe.,The system shall provide the capability to generate a contract expirations report to identify the conclusion of activities such as POP end dates for a given timeframe.,Requirement
smf0250000,SMF-25,SMF-25 The system shall provide the capability to manipulate data elements during the generation of an ad hoc report.,The system shall provide the capability to manipulate data elements during the generation of an ad hoc report.,Requirement
smf0250100,SMF-25.01,SMF-25.01 The system shall provide the capability to filter data elements during the generation of an ad hoc report.,The system shall provide the capability to filter data elements during the generation of an ad hoc report.,Requirement
smf0250200,SMF-25.02,SMF-25.02 The system shall provide the capability to sort data elements during the generation of an ad hoc report.,The system shall provide the capability to sort data elements during the generation of an ad hoc report.,Requirement
smf0250300,SMF-25.03,SMF-25.03 The system shall provide the capability to group data elements during the generation of an ad hoc report.,The system shall provide the capability to group data elements during the generation of an ad hoc report.,Requirement
smf0250400,SMF-25.04,SMF-25.04 The system shall provide the capability to perform common math functions on data elements during the generation of an ad hoc report.,The system shall provide the capability to perform common math functions on data elements during the generation of an ad hoc report.,Requirement
smf0260000,SMF-26,SMF-26 The system shall provide the capability to concatenate a data field for inclusion in an ad hoc report.,The system shall provide the capability to concatenate a data field for inclusion in an ad hoc report.,Requirement
smf0260100,SMF-26.01,SMF-26.01 The system shall provide the capability to deconstruct a data field for inclusion in an ad hoc report.,The system shall provide the capability to deconstruct a data field for inclusion in an ad hoc report.,Requirement
smf0270000,SMF-27,"SMF-27 The system shall provide the capability to summarize data groups (e.g., line items) during the generation of an ad hoc report.","The system shall provide the capability to summarize data groups (e.g., line items) during the generation of an ad hoc report.",Requirement
smf0280000,SMF-28,SMF-28 The system shall provide the capability to drill-down exposing the detailed data that comprises each set of summary information.,The system shall provide the capability to drill-down exposing the detailed data that comprises each set of summary information.,Requirement
smf0290000,SMF-29,"SMF-29 The system shall provide the capability to create run-time parameters (i.e., user-entered criteria) during the generation of an ad hoc report.","The system shall provide the capability to create run-time parameters (i.e., user-entered criteria) during the generation of an ad hoc report.",Requirement
smf0290100,SMF-29.01,SMF-29.01 The system shall allow run-time parameters to be defined as a single value.,The system shall allow run-time parameters to be defined as a single value.,Requirement
smf0290200,SMF-29.02,SMF-29.02 The system shall allow run-time parameters to be defined as multiple values.,The system shall allow run-time parameters to be defined as multiple values.,Requirement
smf0290300,SMF-29.03,SMF-29.03 The system shall allow run-time parameters to be defined as a range of values.,The system shall allow run-time parameters to be defined as a range of values.,Requirement
smf0300000,SMF-30,"SMF-30 The system shall provide the capability to create conditional output fields based on data elements (e.g., if a document’s executed date is blank, then display “Non-Executed”) for a report.","The system shall provide the capability to create conditional output fields based on data elements (e.g., if a document’s executed date is blank, then display “Non-Executed”) for a report.",Requirement
smf0310000,SMF-31,"SMF-31 The system shall provide the capability to alias data columns (i.e., identify a column differently than the database field name).","The system shall provide the capability to alias data columns (i.e., identify a column differently than the database field name).",Requirement
