dca1470000,DCA-147,DCA-147 The system shall enable a user to cancel a solicitation instrument (via Amendment) at any point prior to execution of an award instrument that references the solicitation instrument.,The system shall enable a user to cancel a solicitation instrument (via Amendment) at any point prior to execution of an award instrument that references the solicitation instrument.,Requirement
dca1480000,DCA-148,DCA-148 The system shall provide the ability for a user to enter a cancellation effective date when a user cancels a solicitation instrument.,The system shall provide the ability for a user to enter a cancellation effective date when a user cancels a solicitation instrument.,Requirement
dca1490000,DCA-149,DCA-149 The system shall enable an authorized user to sign an award instrument.,The system shall enable an authorized user to sign an award instrument.,Requirement
dca1500000,DCA-150,DCA-150 The system shall create an outbound transaction data set when the instrument has been signed.,The system shall create an outbound transaction data set when the instrument has been signed.,Requirement
dca1500100,DCA-150.01,DCA-150.01 The system shall store an outbound transaction data set when the instrument has been signed.,The system shall store an outbound transaction data set when the instrument has been signed.,Requirement
dca1500200,DCA-150.02,DCA-150.02 The system shall save to a designated file directory an outbound transaction data set when the instrument has been signed.,The system shall save to a designated file directory an outbound transaction data set when the instrument has been signed.,Requirement
dca1510000,DCA-151,DCA-151 The system shall create and save to the ECF a read-only digital file exactly replicating the instrument package.,The system shall create and save to the ECF a read-only digital file exactly replicating the instrument package.,Requirement
dca1510100,DCA-151.01,DCA-151.01 The system shall replicate all documents added to the instrument upon instrument signature.,The system shall replicate all documents added to the instrument upon instrument signature.,Requirement
dca1510200,DCA-151.02,DCA-151.02 The system shall replicate all exhibits added to the instrument upon instrument signature.,The system shall replicate all exhibits added to the instrument upon instrument signature.,Requirement
dca1510300,DCA-151.03,DCA-151.03 The system shall replicate all attachments added to the instrument upon instrument signature.,The system shall replicate all attachments added to the instrument upon instrument signature.,Requirement
dca1520000,DCA-152,DCA-152 The system shall record the Line Item Obligation Amount against any PR Line Item referenced in an award instrument line item upon instrument signature.,The system shall record the Line Item Obligation Amount against any PR Line Item referenced in an award instrument line item upon instrument signature.,Requirement
dca1530000,DCA-153,DCA-153 The system shall validate that the sum total amount of the Line Items does not exceed the funds available on associated PR line items.,The system shall validate that the sum total amount of the Line Items does not exceed the funds available on associated PR line items.,Requirement
dca1540000,DCA-154,DCA-154 The system shall distribute the signed instrument package in read-only digital format to recipients identified by the user upon instrument signature.,The system shall distribute the signed instrument package in read-only digital format to recipients identified by the user upon instrument signature.,Requirement
dca1550000,DCA-155,DCA-155 The system shall enable a user to search instruments based on any data associated with the instrument.,The system shall enable a user to search instruments based on any data associated with the instrument.,Requirement
dca1560000,DCA-156,DCA-156 The system shall enable a user to establish instrument line item funding information IAW DFARS Subpart 204.71.,The system shall enable a user to establish instrument line item funding information IAW DFARS Subpart 204.71.,Requirement
dca1570000,DCA-157,DCA-157 The system shall provide the ability for Government to digitally sign instruments.,The system shall provide the ability for Government to digitally sign instruments.,Requirement
dca1580000,DCA-158,DCA-158 The system shall provide the ability for Vendors to digitally sign instruments.,The system shall provide the ability for Vendors to digitally sign instruments.,Requirement
dca1590000,DCA-159,DCA-159 The system shall provide a method to ensure digital signatures on instruments are non-repudiable.,The system shall provide a method to ensure digital signatures on instruments are non-repudiable.,Requirement
dca1600000,DCA-160,DCA-160 The system shall provide the capability to re-render a document via a different form type.,The system shall provide the capability to re-render a document via a different form type.,Requirement
dcb0010000,DCB-01,DCB-01 The system shall enable a user to create Informational CLINs IAW DFARS Subpart 204.71.,The system shall enable a user to create Informational CLINs IAW DFARS Subpart 204.71.,Requirement
dcb0020000,DCB-02,DCB-02 The system shall enable a user to create Price CLINs IAW DFARS Subpart 204.71.,The system shall enable a user to create Price CLINs IAW DFARS Subpart 204.71.,Requirement
dcb0030000,DCB-03,DCB-03 The system shall enable a user to create Informational SLINs IAW DFARS Subpart 204.7104-1(a) and PGI 204.7104-2(a).,The system shall enable a user to create Informational SLINs IAW DFARS Subpart 204.7104-1(a) and PGI 204.7104-2(a).,Requirement
dcb0040000,DCB-04,DCB-04 The system shall enable a user to create Price SLINs IAW DFARS Subpart 204.71.,The system shall enable a user to create Price SLINs IAW DFARS Subpart 204.71.,Requirement
dcb0050000,DCB-05,DCB-05 The system shall enable a user to create Price ELINs IAW DFARS Subpart 204.71.,The system shall enable a user to create Price ELINs IAW DFARS Subpart 204.71.,Requirement
dcb0060000,DCB-06,DCB-06 The system shall assign line item numbers IAW DFARS Subpart 204.71 when a user initiates the creation of a new line item on an instrument.,The system shall assign line item numbers IAW DFARS Subpart 204.71 when a user initiates the creation of a new line item on an instrument.,Requirement
dcb0070000,DCB-07,DCB-07 The system shall enable a user to edit line item numbers IAW DFARS Subpart 204.71 when that user initiates the creation of a new line item on an instrument.,The system shall enable a user to edit line item numbers IAW DFARS Subpart 204.71 when that user initiates the creation of a new line item on an instrument.,Requirement
dcb0080000,DCB-08,DCB-08 The system shall assign the next sequential number IAW DFARS Subpart 204.71 when assigning a new line item number.,The system shall assign the next sequential number IAW DFARS Subpart 204.71 when assigning a new line item number.,Requirement
dcb0090000,DCB-09,DCB-09 The system shall enable a user to manually assign non-sequential line item numbers IAW DFARS Subpart 204.71,The system shall enable a user to manually assign non-sequential line item numbers IAW DFARS Subpart 204.71,Requirement
dcb0100000,DCB-10,DCB-10 The system shall prohibit duplicate line item numbers on a given instrument.,The system shall prohibit duplicate line item numbers on a given instrument.,Requirement
dcb0110000,DCB-11,DCB-11 The system shall enable a user to add line items on a draft instrument.,The system shall enable a user to add line items on a draft instrument.,Requirement
dcb0120000,DCB-12,DCB-12 The system shall enable a user to edit line items on a draft instrument.,The system shall enable a user to edit line items on a draft instrument.,Requirement
dcb0130000,DCB-13,DCB-13 The system shall enable a user to delete line items on a draft instrument.,The system shall enable a user to delete line items on a draft instrument.,Requirement
dcb0140000,DCB-14,DCB-14 The system shall prevent a user from deleting existing line items from the award via modification.,The system shall prevent a user from deleting existing line items from the award via modification.,Requirement
dcb0150000,DCB-15,DCB-15 The system shall enable a user to delete line items within an existing modification instrument.,The system shall enable a user to delete line items within an existing modification instrument.,Requirement
dcb0160000,DCB-16,DCB-16 The system shall prevent a user from mixing SLIN types associated with a CLIN.,The system shall prevent a user from mixing SLIN types associated with a CLIN.,Requirement
dcb0170000,DCB-17,DCB-17 The system shall prohibit a user from creating a SLIN without the presence of an associated CLIN on the immediate instrument.,The system shall prohibit a user from creating a SLIN without the presence of an associated CLIN on the immediate instrument.,Requirement
dcb0180000,DCB-18,DCB-18 The system shall enable a user to enter different line item descriptive information on CLINs and their SLINs IAW DFARS Subpart 204.71.,The system shall enable a user to enter different line item descriptive information on CLINs and their SLINs IAW DFARS Subpart 204.71.,Requirement
dcb0190000,DCB-19,DCB-19 The system shall enable a user to add ELINs to CLINs IAW DFARS Subpart 204.7105.,The system shall enable a user to add ELINs to CLINs IAW DFARS Subpart 204.7105.,Requirement
dcb0200000,DCB-20,DCB-20 The system shall enable a user to add ELINs to SLINs IAW DFARS Subpart 204.7105.,The system shall enable a user to add ELINs to SLINs IAW DFARS Subpart 204.7105.,Requirement
dcb0210000,DCB-21,"DCB-21 The system shall enable a user to identify CLINs as ""base"" CLINs IAW DFARS 217.2.","The system shall enable a user to identify CLINs as ""base"" CLINs IAW DFARS 217.2.",Requirement
dcb0220000,DCB-22,"DCB-22 The system shall enable a user to identify CLINs as ""unexercised option"" CLINs IAW DFARS 217.2.","The system shall enable a user to identify CLINs as ""unexercised option"" CLINs IAW DFARS 217.2.",Requirement
dcb0230000,DCB-23,"DCB-23 The system shall enable a user to identify CLINs as ""exercised option"" CLINs IAW DFARS 217.2.","The system shall enable a user to identify CLINs as ""exercised option"" CLINs IAW DFARS 217.2.",Requirement
dcb0240000,DCB-24,DCB-24 The system shall enable the user to identify SLINs associated to a set of CLINs in terms of “base option”.,The system shall enable the user to identify SLINs associated to a set of CLINs in terms of “base option”.,Requirement
dcb0250000,DCB-25,"DCB-25 The system shall enable the user to identify SLINs associated to a set of CLINs in terms of ""unexercised option.""","The system shall enable the user to identify SLINs associated to a set of CLINs in terms of ""unexercised option.""",Requirement
dcb0260000,DCB-26,"DCB-26 The system shall enable the user to identify SLINs associated to a set of CLINs in terms of ""exercised option.""","The system shall enable the user to identify SLINs associated to a set of CLINs in terms of ""exercised option.""",Requirement
dcb0270000,DCB-27,"DCB-27 The system shall enable the user to identify ELINs associated to a set of CLINs in terms of ""base option.""","The system shall enable the user to identify ELINs associated to a set of CLINs in terms of ""base option.""",Requirement
dcb0280000,DCB-28,"DCB-28 The system shall enable the user to identify ELINs associated to a set of CLINs in terms of ""unexercised option.""","The system shall enable the user to identify ELINs associated to a set of CLINs in terms of ""unexercised option.""",Requirement
dcb0290000,DCB-29,"DCB-29 The system shall enable the user to identify ELINs associated to a set of CLINs in terms of ""exercised option.""","The system shall enable the user to identify ELINs associated to a set of CLINs in terms of ""exercised option.""",Requirement
dcb0300000,DCB-30,DCB-30 The system shall enable a user to replicate multiple line items within an instrument when business rules permit.,The system shall enable a user to replicate multiple line items within an instrument when business rules permit.,Requirement
dcb0310000,DCB-31,DCB-31 The system shall preserve any existing line item structure when multiple line items have been replicated within an instrument.,The system shall preserve any existing line item structure when multiple line items have been replicated within an instrument.,Requirement
dcb0320000,DCB-32,DCB-32 The system shall enable a user to replicate one to all data fields associated with each line item when replicating line items within an instrument.,The system shall enable a user to replicate one to all data fields associated with each line item when replicating line items within an instrument.,Requirement
dcb0330000,DCB-33,DCB-33 The system shall enable a user to replicate all SLINs associated with the CLIN when replicating a CLIN.,The system shall enable a user to replicate all SLINs associated with the CLIN when replicating a CLIN.,Requirement
dcb0340000,DCB-34,DCB-34 The system shall enable a user to replicate no SLINs associated with the CLIN when replicating a CLIN.,The system shall enable a user to replicate no SLINs associated with the CLIN when replicating a CLIN.,Requirement
dcb0350000,DCB-35,DCB-35 The system shall enable a user to replicate specifically selected set of SLINs associated with the CLIN when replicating a CLIN.,The system shall enable a user to replicate specifically selected set of SLINs associated with the CLIN when replicating a CLIN.,Requirement
dcb0360000,DCB-36,DCB-36 The system shall not replicate associated ELINs when replicating CLINs or SLINs.,The system shall not replicate associated ELINs when replicating CLINs or SLINs.,Requirement
dcb0370000,DCB-37,DCB-37 The system shall enable a user to replicate line items from one instrument to another when business rules are met.,The system shall enable a user to replicate line items from one instrument to another when business rules are met.,Requirement
dcb0380000,DCB-38,DCB-38 The system shall retain the line item substructure when duplicating line item sections.,The system shall retain the line item substructure when duplicating line item sections.,Requirement
dcb0390000,DCB-39,"DCB-39 The system shall enable a user to enter descriptive, free-form text at the instrument line item level.","The system shall enable a user to enter descriptive, free-form text at the instrument line item level.",Requirement
dcb0390100,DCB-39.01,"DCB-39.01 The system shall limit the instrument line item descriptive, free-form text to 2,000 characters.","The system shall limit the instrument line item descriptive, free-form text to 2,000 characters.",Requirement
dcb0400000,DCB-40,DCB-40 The system shall associate line item data with the appropriate document section in UCF or equivalent.,The system shall associate line item data with the appropriate document section in UCF or equivalent.,Requirement
dcb0410000,DCB-41,DCB-41 The system shall enable the user to display line item data in UCF or equivalent prior to printing.,The system shall enable the user to display line item data in UCF or equivalent prior to printing.,Requirement
dcb0420000,DCB-42,DCB-42 The system shall enable the user to print line item data with the appropriate document section in UCF or equivalent.,The system shall enable the user to print line item data with the appropriate document section in UCF or equivalent.,Requirement
dcb0430000,DCB-43,DCB-43 The system shall enable a user to enter foreign military sales information on an instrument line item if the information was not available from the associated PR.,The system shall enable a user to enter foreign military sales information on an instrument line item if the information was not available from the associated PR.,Requirement
dcb0440000,DCB-44,"DCB-44 The system shall enable a user to enter the Item Unique Identification (IUID) information when required by the DFARS Subpart 211.274 and DoD Standard Practice, ""Identification Marking of US Military Property, MIL-STD-130.","The system shall enable a user to enter the Item Unique Identification (IUID) information when required by the DFARS Subpart 211.274 and DoD Standard Practice, ""Identification Marking of US Military Property, MIL-STD-130.",Requirement
dcb0450000,DCB-45,DCB-45 The system shall enable a user to enter Radio Frequency Identification (RFID) information when required by the DFARS Subpart 211.275.,The system shall enable a user to enter Radio Frequency Identification (RFID) information when required by the DFARS Subpart 211.275.,Requirement
dcb0460000,DCB-46,DCB-46 The system shall provide the capability to capture purchase history by NSN.,The system shall provide the capability to capture purchase history by NSN.,Requirement
dcb0460100,DCB-46.01,DCB-46.01 The system shall provide the capability for a user to look up historical purchases placed within the ePS architecture based upon an NSN.,The system shall provide the capability for a user to look up historical purchases placed within the ePS architecture based upon an NSN.,Requirement
dcb0460200,DCB-46.02,DCB-46.02 The system shall only allow one NSN per line item.,The system shall only allow one NSN per line item.,Requirement
dcb0470000,DCB-47,"DCB-47 The system shall enable a user to identify an instrument line item as a ""Representative Buy"" for a given NSN.","The system shall enable a user to identify an instrument line item as a ""Representative Buy"" for a given NSN.",Requirement
dcb0480000,DCB-48,"DCB-48 The system shall enable a user to identify an instrument line item as a ""Non-Representative Buy"" for a given NSN.","The system shall enable a user to identify an instrument line item as a ""Non-Representative Buy"" for a given NSN.",Requirement
dcb0490000,DCB-49,"DCB-49 The system shall use ""Representative Buy"" as the default value.","The system shall use ""Representative Buy"" as the default value.",Requirement
dcb0500000,DCB-50,DCB-50 The system shall enable a user to display a Line Item Summary Table for award instruments and associated modifications.,The system shall enable a user to display a Line Item Summary Table for award instruments and associated modifications.,Requirement
dcb0500100,DCB-50.01,DCB-50.01 The system shall enable a user to display a Line Item Summary Table for signed award instruments and associated modifications.,The system shall enable a user to display a Line Item Summary Table for signed award instruments and associated modifications.,Requirement
dcb0500200,DCB-50.02,DCB-50.02 The system shall enable a user to display a Line Item Summary Table for unsigned award instruments and associated modifications.,The system shall enable a user to display a Line Item Summary Table for unsigned award instruments and associated modifications.,Requirement
dcb0510000,DCB-51,DCB-51 The system shall enable a user to export a Line Item Summary Table for award instruments and associated modifications.,The system shall enable a user to export a Line Item Summary Table for award instruments and associated modifications.,Requirement
dcb0510100,DCB-51.01,DCB-51.01 The system shall enable a user to export a Line Item Summary Table for signed award instruments and associated modifications.,The system shall enable a user to export a Line Item Summary Table for signed award instruments and associated modifications.,Requirement
dcb0510200,DCB-51.02,DCB-51.02 The system shall enable a user to export a Line Item Summary Table for unsigned award instruments and associated modifications.,The system shall enable a user to export a Line Item Summary Table for unsigned award instruments and associated modifications.,Requirement
dcb0520000,DCB-52,DCB-52 The system shall include conformed information for each Award Instrument Line Item within the summary.,The system shall include conformed information for each Award Instrument Line Item within the summary.,Requirement
dcb0520100,DCB-52.01,DCB-52.01 The system shall include the award instrument number for each award instrument number within the summary.,The system shall include the award instrument number for each award instrument number within the summary.,Requirement
dcb0520200,DCB-52.02,DCB-52.02 The system shall include the award instrument number for each award line item number within the summary.,The system shall include the award instrument number for each award line item number within the summary.,Requirement
dcb0520300,DCB-52.03,DCB-52.03 The system shall include the award instrument number for each description within the summary.,The system shall include the award instrument number for each description within the summary.,Requirement
dcb0520400,DCB-52.04,DCB-52.04 The system shall include the award instrument number for each quantity within the summary.,The system shall include the award instrument number for each quantity within the summary.,Requirement
dcb0520500,DCB-52.05,DCB-52.05 The system shall include the award instrument number for each unit price within the summary.,The system shall include the award instrument number for each unit price within the summary.,Requirement
dcb0520600,DCB-52.06,DCB-52.06 The system shall include the award instrument number for each extended price within the summary.,The system shall include the award instrument number for each extended price within the summary.,Requirement
dcb0520700,DCB-52.07,DCB-52.07 The system shall include the award instrument number for each obligated amount within the summary.,The system shall include the award instrument number for each obligated amount within the summary.,Requirement
dcb0520800,DCB-52.08,DCB-52.08 The system shall include the award instrument number for each delivery date or period of performance (POP) start dates within the summary.,The system shall include the award instrument number for each delivery date or period of performance (POP) start dates within the summary.,Requirement
dcb0520900,DCB-52.09,DCB-52.09 The system shall include the award instrument number for each delivery date or period of performance (POP) end dates within the summary.,The system shall include the award instrument number for each delivery date or period of performance (POP) end dates within the summary.,Requirement
dcb0521000,DCB-52.10,DCB-52.10 The system shall include the award instrument number for each POP within the summary.,The system shall include the award instrument number for each POP within the summary.,Requirement
dcb0521100,DCB-52.11,DCB-52.11 The system shall include the award instrument number for each place of delivery within the summary.,The system shall include the award instrument number for each place of delivery within the summary.,Requirement
dcb0530000,DCB-53,DCB-53 The system shall provide the capability to prohibit the execution of a concurrent modification that is generated from an older version of the document.,The system shall provide the capability to prohibit the execution of a concurrent modification that is generated from an older version of the document.,Requirement
dcb0540000,DCB-54,DCB-54 The system shall display an indicator on a draft modification instrument line item when a basic line item being modified has been referenced on another draft modification instrument line item.,The system shall display an indicator on a draft modification instrument line item when a basic line item being modified has been referenced on another draft modification instrument line item.,Requirement
dcb0550000,DCB-55,DCB-55 The system shall enable a user to view the draft changes to the line item data for the other concurrent draft modification or modifications when a concurrent line item modification indicator is present.,The system shall enable a user to view the draft changes to the line item data for the other concurrent draft modification or modifications when a concurrent line item modification indicator is present.,Requirement
dcb0560000,DCB-56,DCB-56 The system shall enable a user to display a list of draft concurrent line item modifications prior to signing an instrument.,The system shall enable a user to display a list of draft concurrent line item modifications prior to signing an instrument.,Requirement
dcb0570000,DCB-57,DCB-57 The system shall display the list of concurrent line item modifications when signing an instrument.,The system shall display the list of concurrent line item modifications when signing an instrument.,Requirement
dcb0580000,DCB-58,DCB-58 The system shall prompt the user to select whether or not to proceed with signature and overwrite the line item data in other draft concurrent modifications when signing an instrument where concurrent line item modifications exist.,The system shall prompt the user to select whether or not to proceed with signature and overwrite the line item data in other draft concurrent modifications when signing an instrument where concurrent line item modifications exist.,Requirement
dcb0590000,DCB-59,DCB-59 The system shall update the affected line items on other concurrent modifications and notify their owners if the user selects to sign the modification.,The system shall update the affected line items on other concurrent modifications and notify their owners if the user selects to sign the modification.,Requirement
dcb0600000,DCB-60,DCB-60 The system shall designate the line item as terminated when a line item has been terminated.,The system shall designate the line item as terminated when a line item has been terminated.,Requirement
dcb0610000,DCB-61,DCB-61 The system shall designate the line item as cancelled when a line item has been cancelled.,The system shall designate the line item as cancelled when a line item has been cancelled.,Requirement
