isa0010000,ISA-01,ISA-01 The system shall capture a solicitation using the appropriate form for the Procurement Method selected based upon PR parameters according to Section A of FAR subsection 15.204-1 – Uniform contract format.,The system shall capture a solicitation using the appropriate form for the Procurement Method selected based upon PR parameters according to Section A of FAR subsection 15.204-1 – Uniform contract format.,Requirement
isa0020000,ISA-02,ISA-02 The system shall capture supply entries of the solicitation according to Section B of FAR subsection 15.204-1 – Uniform contract format.,The system shall capture supply entries of the solicitation according to Section B of FAR subsection 15.204-1 – Uniform contract format.,Requirement
isa0020100,ISA-02.01,ISA-02.01 The system shall capture quantity supply entries of the solicitation according to Section B of FAR subsection 15.204-1 – Uniform contract format.,The system shall capture quantity supply entries of the solicitation according to Section B of FAR subsection 15.204-1 – Uniform contract format.,Requirement
isa0020200,ISA-02.02,ISA-02.02 The system shall capture unit of measure supply entries of the solicitation according to Section B of FAR subsection 15.204-1 – Uniform contract format.,The system shall capture unit of measure supply entries of the solicitation according to Section B of FAR subsection 15.204-1 – Uniform contract format.,Requirement
isa0020300,ISA-02.03,ISA-02.03 The system shall capture unit price supply entries of the solicitation according to Section B of FAR subsection 15.204-1 – Uniform contract format.,The system shall capture unit price supply entries of the solicitation according to Section B of FAR subsection 15.204-1 – Uniform contract format.,Requirement
isa0020400,ISA-02.04,ISA-02.04 The system shall capture extended price supply entries of the solicitation according to Section B of FAR subsection 15.204-1 – Uniform contract format.,The system shall capture extended price supply entries of the solicitation according to Section B of FAR subsection 15.204-1 – Uniform contract format.,Requirement
isa0020500,ISA-02.05,ISA-02.05 The system shall capture description supply entries of the solicitation according to Section B of FAR subsection 15.204-1 – Uniform contract format.,The system shall capture description supply entries of the solicitation according to Section B of FAR subsection 15.204-1 – Uniform contract format.,Requirement
isa0020600,ISA-02.06,ISA-02.06 The system shall capture Product Service Code (PSC) supply entries of the solicitation according to Section B of FAR subsection 15.204-1 – Uniform contract format.,The system shall capture Product Service Code (PSC) supply entries of the solicitation according to Section B of FAR subsection 15.204-1 – Uniform contract format.,Requirement
isa0020700,ISA-02.07,ISA-02.07 The system shall capture SLIN supply entries of the solicitation according to Section B of FAR subsection 15.204-1 – Uniform contract format.,The system shall capture SLIN supply entries of the solicitation according to Section B of FAR subsection 15.204-1 – Uniform contract format.,Requirement
isa0020800,ISA-02.08,ISA-02.08 The system shall capture item number/NSN/part number supply entries of the solicitation according to Section B of FAR subsection 15.204-1 – Uniform contract format.,The system shall capture item number/NSN/part number supply entries of the solicitation according to Section B of FAR subsection 15.204-1 – Uniform contract format.,Requirement
isa0020900,ISA-02.09,ISA-02.09 The system shall capture POP/delivery supply entries of the solicitation according to Section B of FAR subsection 15.204-1 – Uniform contract format.,The system shall capture POP/delivery supply entries of the solicitation according to Section B of FAR subsection 15.204-1 – Uniform contract format.,Requirement
isa0021000,ISA-02.10,ISA-02.10 The system shall capture other narratives supply entries of the solicitation according to Section B of FAR subsection 15.204-1 – Uniform contract format.,The system shall capture other narratives supply entries of the solicitation according to Section B of FAR subsection 15.204-1 – Uniform contract format.,Requirement
isa0021100,ISA-02.11,ISA-02.11 The system shall capture CLIN supply entries of the solicitation according to Section B of FAR subsection 15.204-1 – Uniform contract format.,The system shall capture CLIN supply entries of the solicitation according to Section B of FAR subsection 15.204-1 – Uniform contract format.,Requirement
isa0021200,ISA-02.12,ISA-02.12 The system shall capture NAICS supply entries of the solicitation according to Section B of FAR subsection 15.204-1 – Uniform contract format.,The system shall capture NAICS supply entries of the solicitation according to Section B of FAR subsection 15.204-1 – Uniform contract format.,Requirement
isa0021300,ISA-02.13,ISA-02.13 The system shall capture UNSPSC supply entries of the solicitation according to Section B of FAR subsection 15.204-1 – Uniform contract format.,The system shall capture UNSPSC supply entries of the solicitation according to Section B of FAR subsection 15.204-1 – Uniform contract format.,Requirement
isa0030000,ISA-03,"ISA-03 The system shall capture SOW information via the SOW template, according to Section C of FAR subsection 15.204-1 – Uniform contract format.","The system shall capture SOW information via the SOW template, according to Section C of FAR subsection 15.204-1 – Uniform contract format.",Requirement
isa0030100,ISA-03.01,"ISA-03.01 The system shall capture the scope via the SOW template, according to Section C of FAR subsection 15.204-1 – Uniform contract format.","The system shall capture the scope via the SOW template, according to Section C of FAR subsection 15.204-1 – Uniform contract format.",Requirement
isa0030200,ISA-03.02,"ISA-03.02 The system shall capture applicable documents via the SOW template, according to Section C of FAR subsection 15.204-1 – Uniform contract format.","The system shall capture applicable documents via the SOW template, according to Section C of FAR subsection 15.204-1 – Uniform contract format.",Requirement
isa0030300,ISA-03.03,"ISA-03.03 The system shall capture the requirements via the SOW template, according to Section C of FAR subsection 15.204-1 – Uniform contract format.","The system shall capture the requirements via the SOW template, according to Section C of FAR subsection 15.204-1 – Uniform contract format.",Requirement
isa0030400,ISA-03.04,"ISA-03.04 The system shall capture the deliverables via the SOW template, according to Section C of FAR subsection 15.204-1 – Uniform contract format.","The system shall capture the deliverables via the SOW template, according to Section C of FAR subsection 15.204-1 – Uniform contract format.",Requirement
isa0030500,ISA-03.05,"ISA-03.05 The system shall capture the project schedule via the SOW template, according to Section C of FAR subsection 15.204-1 – Uniform contract format.","The system shall capture the project schedule via the SOW template, according to Section C of FAR subsection 15.204-1 – Uniform contract format.",Requirement
isa0030600,ISA-03.06,"ISA-03.06 The system shall capture administrative support via the SOW template, according to Section C of FAR subsection 15.204-1 – Uniform contract format.","The system shall capture administrative support via the SOW template, according to Section C of FAR subsection 15.204-1 – Uniform contract format.",Requirement
isa0030700,ISA-03.07,"ISA-03.07 The system shall capture travel information via the SOW template, according to Section C of FAR subsection 15.204-1 – Uniform contract format.","The system shall capture travel information via the SOW template, according to Section C of FAR subsection 15.204-1 – Uniform contract format.",Requirement
isa0030800,ISA-03.08,"ISA-03.08 The system shall capture other direct costs via the SOW template, according to Section C of FAR subsection 15.204-1 – Uniform contract format.","The system shall capture other direct costs via the SOW template, according to Section C of FAR subsection 15.204-1 – Uniform contract format.",Requirement
isa0030900,ISA-03.09,"ISA-03.09 The system shall capture other elements as defined by the HCA via the SOW template, according to Section C of FAR subsection 15.204-1 – Uniform contract format.","The system shall capture other elements as defined by the HCA via the SOW template, according to Section C of FAR subsection 15.204-1 – Uniform contract format.",Requirement
isa0040000,ISA-04,"ISA-04 The system shall capture PWS information via the PWS template, according to Section C of FAR subsection 15.204-1 – Uniform contract format.","The system shall capture PWS information via the PWS template, according to Section C of FAR subsection 15.204-1 – Uniform contract format.",Requirement
isa0040100,ISA-04.01,"ISA-04.01 The system shall capture the scope via the PWS template, according to Section C of FAR subsection 15.204-1 – Uniform contract format.","The system shall capture the scope via the PWS template, according to Section C of FAR subsection 15.204-1 – Uniform contract format.",Requirement
isa0040200,ISA-04.02,"ISA-04.02 The system shall capture applicable documents via the PWS template, according to Section C of FAR subsection 15.204-1 – Uniform contract format.","The system shall capture applicable documents via the PWS template, according to Section C of FAR subsection 15.204-1 – Uniform contract format.",Requirement
isa0040300,ISA-04.03,"ISA-04.03 The system shall capture the requirements via the PWS template, according to Section C of FAR subsection 15.204-1 – Uniform contract format.","The system shall capture the requirements via the PWS template, according to Section C of FAR subsection 15.204-1 – Uniform contract format.",Requirement
isa0040400,ISA-04.04,"ISA-04.04 The system shall capture the deliverables via the PWS template, according to Section C of FAR subsection 15.204-1 – Uniform contract format.","The system shall capture the deliverables via the PWS template, according to Section C of FAR subsection 15.204-1 – Uniform contract format.",Requirement
isa0040500,ISA-04.05,"ISA-04.05 The system shall capture the project schedule via the PWS template, according to Section C of FAR subsection 15.204-1 – Uniform contract format.","The system shall capture the project schedule via the PWS template, according to Section C of FAR subsection 15.204-1 – Uniform contract format.",Requirement
isa0040600,ISA-04.06,"ISA-04.06 The system shall capture administrative support via the PWS template, according to Section C of FAR subsection 15.204-1 – Uniform contract format.","The system shall capture administrative support via the PWS template, according to Section C of FAR subsection 15.204-1 – Uniform contract format.",Requirement
isa0040700,ISA-04.07,"ISA-04.07 The system shall capture travel information via the PWS template, according to Section C of FAR subsection 15.204-1 – Uniform contract format.","The system shall capture travel information via the PWS template, according to Section C of FAR subsection 15.204-1 – Uniform contract format.",Requirement
isa0040800,ISA-04.08,"ISA-04.08 The system shall capture other direct costs via the PWS template, according to Section C of FAR subsection 15.204-1 – Uniform contract format.","The system shall capture other direct costs via the PWS template, according to Section C of FAR subsection 15.204-1 – Uniform contract format.",Requirement
isa0040900,ISA-04.09,"ISA-04.09 The system shall capture other elements as defined by the HCA via the PWS template, according to Section C of FAR subsection 15.204-1 – Uniform contract format.","The system shall capture other elements as defined by the HCA via the PWS template, according to Section C of FAR subsection 15.204-1 – Uniform contract format.",Requirement
isa0050000,ISA-05,"ISA-05 The system shall capture SOO information via the SOO template, according to Section C of FAR subsection 15.204-1 – Uniform contract format.","The system shall capture SOO information via the SOO template, according to Section C of FAR subsection 15.204-1 – Uniform contract format.",Requirement
isa0050100,ISA-05.01,"ISA-05.01 The system shall capture the scope via the SOO template, according to Section C of FAR subsection 15.204-1 – Uniform contract format.","The system shall capture the scope via the SOO template, according to Section C of FAR subsection 15.204-1 – Uniform contract format.",Requirement
isa0050200,ISA-05.02,"ISA-05.02 The system shall capture applicable documents via the SOO template, according to Section C of FAR subsection 15.204-1 – Uniform contract format.","The system shall capture applicable documents via the SOO template, according to Section C of FAR subsection 15.204-1 – Uniform contract format.",Requirement
isa0050300,ISA-05.03,"ISA-05.03 The system shall capture the requirements via the SOO template, according to Section C of FAR subsection 15.204-1 – Uniform contract format.","The system shall capture the requirements via the SOO template, according to Section C of FAR subsection 15.204-1 – Uniform contract format.",Requirement
isa0050400,ISA-05.04,"ISA-05.04 The system shall capture the deliverables via the SOO template, according to Section C of FAR subsection 15.204-1 – Uniform contract format.","The system shall capture the deliverables via the SOO template, according to Section C of FAR subsection 15.204-1 – Uniform contract format.",Requirement
isa0050500,ISA-05.05,"ISA-05.05 The system shall capture the project schedule via the SOO template, according to Section C of FAR subsection 15.204-1 – Uniform contract format.","The system shall capture the project schedule via the SOO template, according to Section C of FAR subsection 15.204-1 – Uniform contract format.",Requirement
isa0050600,ISA-05.06,"ISA-05.06 The system shall capture administrative support via the SOO template, according to Section C of FAR subsection 15.204-1 – Uniform contract format.","The system shall capture administrative support via the SOO template, according to Section C of FAR subsection 15.204-1 – Uniform contract format.",Requirement
isa0050700,ISA-05.07,"ISA-05.07 The system shall capture travel information via the SOO template, according to Section C of FAR subsection 15.204-1 – Uniform contract format.","The system shall capture travel information via the SOO template, according to Section C of FAR subsection 15.204-1 – Uniform contract format.",Requirement
isa0050800,ISA-05.08,"ISA-05.08 The system shall capture other direct costs via the SOO template, according to Section C of FAR subsection 15.204-1 – Uniform contract format.","The system shall capture other direct costs via the SOO template, according to Section C of FAR subsection 15.204-1 – Uniform contract format.",Requirement
isa0050900,ISA-05.09,"ISA-05.09 The system shall capture other elements as defined by the HCA via the SOO template, according to Section C of FAR subsection 15.204-1 – Uniform contract format.","The system shall capture other elements as defined by the HCA via the SOO template, according to Section C of FAR subsection 15.204-1 – Uniform contract format.",Requirement
isa0060000,ISA-06,ISA-06 The system shall capture Section D packaging requirements according to Section D of FAR subsection 15.204-1 – Uniform contract format.,The system shall capture Section D packaging requirements according to Section D of FAR subsection 15.204-1 – Uniform contract format.,Requirement
isa0070000,ISA-07,ISA-07 The system shall capture Section D packing requirements according to Section D of FAR subsection 15.204-1 – Uniform contract format.,The system shall capture Section D packing requirements according to Section D of FAR subsection 15.204-1 – Uniform contract format.,Requirement
isa0080000,ISA-08,ISA-08 The system shall capture Section D preservation requirements according to Section D of FAR subsection 15.204-1 – Uniform contract format.,The system shall capture Section D preservation requirements according to Section D of FAR subsection 15.204-1 – Uniform contract format.,Requirement
isa0090000,ISA-09,ISA-09 The system shall capture Section D marking requirements according to Section D of FAR subsection 15.204-1 – Uniform contract format.,The system shall capture Section D marking requirements according to Section D of FAR subsection 15.204-1 – Uniform contract format.,Requirement
isa0100000,ISA-10,ISA-10 The system shall capture SOW details for each selected header from pre-defined boilerplates according to Section F of FAR subsection 15.204-1 – Uniform contract format.,The system shall capture SOW details for each selected header from pre-defined boilerplates according to Section F of FAR subsection 15.204-1 – Uniform contract format.,Requirement
isa0110000,ISA-11,ISA-11 The system shall capture SOW details for each selected header filled-in by users according to Section F of FAR subsection 15.204-1 – Uniform contract format.,The system shall capture SOW details for each selected header filled-in by users according to Section F of FAR subsection 15.204-1 – Uniform contract format.,Requirement
isa0120000,ISA-12,ISA-12 The system shall capture delivery requirements according to Section F of FAR subsection 15.204-1 – Uniform contract format.,The system shall capture delivery requirements according to Section F of FAR subsection 15.204-1 – Uniform contract format.,Requirement
isa0130000,ISA-13,ISA-13 The system shall capture performance requirements according to Section F of FAR subsection 15.204-1 – Uniform contract format.,The system shall capture performance requirements according to Section F of FAR subsection 15.204-1 – Uniform contract format.,Requirement
isa0140000,ISA-14,ISA-14 The system shall capture HCA-defined requirements according to Section F of FAR subsection 15.204-1 – Uniform contract format.,The system shall capture HCA-defined requirements according to Section F of FAR subsection 15.204-1 – Uniform contract format.,Requirement
isa0150000,ISA-15,ISA-15 The system shall capture contract administration information and instructions according to Section G of FAR subsection 15.204-1 – Uniform contract format.,The system shall capture contract administration information and instructions according to Section G of FAR subsection 15.204-1 – Uniform contract format.,Requirement
isa0160000,ISA-16,ISA-16 The system shall capture special contract requirements according to Section H of FAR subsection 15.204-1 – Uniform contract format.,The system shall capture special contract requirements according to Section H of FAR subsection 15.204-1 – Uniform contract format.,Requirement
isa0170000,ISA-17,ISA-17 The system shall allow clauses to be tailorable by CLIN.,The system shall allow clauses to be tailorable by CLIN.,Requirement
isa0180000,ISA-18,ISA-18 The system shall prevent duplication of selected clauses in other sections of the solicitation according the Section H of FAR subsection 15.204-1 – Uniform contract format.,The system shall prevent duplication of selected clauses in other sections of the solicitation according the Section H of FAR subsection 15.204-1 – Uniform contract format.,Requirement
isa0180100,ISA-18.01,ISA-18.01 The system shall prevent duplicate clauses by clause numbers.,The system shall prevent duplicate clauses by clause numbers.,Requirement
isa0180200,ISA-18.02,ISA-18.02 The system shall prevent duplicate clauses by full text.,The system shall prevent duplicate clauses by full text.,Requirement
isa0180300,ISA-18.03,ISA-18.03 The system shall prevent duplicate clause names.,The system shall prevent duplicate clause names.,Requirement
isa0190000,ISA-19,ISA-19 The system shall capture contract clause information according to Section I of FAR subsection 15.204-1 - Uniform contract format.,The system shall capture contract clause information according to Section I of FAR subsection 15.204-1 - Uniform contract format.,Requirement
isa0190100,ISA-19.01,ISA-19.01 The system shall provide the capability for the user to indicate that the inclusion of clause information by reference.,The system shall provide the capability for the user to indicate that the inclusion of clause information by reference.,Requirement
isa0190200,ISA-19.02,ISA-19.02 The system shall prevent fill-ins from being used when the clause has been incorporated by reference.,The system shall prevent fill-ins from being used when the clause has been incorporated by reference.,Requirement
isa0190300,ISA-19.03,ISA-19.03 The system shall provide the capability for the user to indicate that the inclusion of clause information in full text.,The system shall provide the capability for the user to indicate that the inclusion of clause information in full text.,Requirement
isa0200000,ISA-20,ISA-20 The system shall capture solicitation provisions that require representations by offerors or respondents according to Section K of FAR subsection 15.204-1 - Uniform contract format.,The system shall capture solicitation provisions that require representations by offerors or respondents according to Section K of FAR subsection 15.204-1 - Uniform contract format.,Requirement
isa0210000,ISA-21,ISA-21 The system shall capture solicitation provisions that require certifications by offerors or respondents according to Section K of FAR subsection 15.204-1 - Uniform contract format.,The system shall capture solicitation provisions that require certifications by offerors or respondents according to Section K of FAR subsection 15.204-1 - Uniform contract format.,Requirement
isa0220000,ISA-22,ISA-22 The system shall capture solicitation provisions that require the submission of other information by offerors or respondents according to Section K of FAR subsection 15.204-1 - Uniform contract format.,The system shall capture solicitation provisions that require the submission of other information by offerors or respondents according to Section K of FAR subsection 15.204-1 - Uniform contract format.,Requirement
isa0230000,ISA-23,ISA-23 The system shall capture instructions to offerors or respondents according to Section L of FAR subsection 15.204-1 - Uniform contract format.,The system shall capture instructions to offerors or respondents according to Section L of FAR subsection 15.204-1 - Uniform contract format.,Requirement
isa0240000,ISA-24,ISA-24 The system shall capture conditions to offerors or respondents according to Section L of FAR subsection 15.204-1 - Uniform contract format.,The system shall capture conditions to offerors or respondents according to Section L of FAR subsection 15.204-1 - Uniform contract format.,Requirement
isa0250000,ISA-25,ISA-25 The system shall capture notices to offerors or respondents according to Section L of FAR subsection 15.204-1 - Uniform contract format.,The system shall capture notices to offerors or respondents according to Section L of FAR subsection 15.204-1 - Uniform contract format.,Requirement
isa0260000,ISA-26,"ISA-26 The system shall provide the capability to identify duplication of selected FAR clauses according to Section L, in other sections of the solicitation.","The system shall provide the capability to identify duplication of selected FAR clauses according to Section L, in other sections of the solicitation.",Requirement
isa0270000,ISA-27,ISA-27 The system shall capture evaluation criteria according to Section M of FAR subsection 15.204-1 - Uniform contract format.,The system shall capture evaluation criteria according to Section M of FAR subsection 15.204-1 - Uniform contract format.,Requirement
isa0280000,ISA-28,ISA-28 The system shall identify those attachments that are sensitive in nature to facilitate restricting their access through utilize Contract Opportunities according to Section J of FAR subsection 15.204-1 - Uniform contract format.,The system shall identify those attachments that are sensitive in nature to facilitate restricting their access through utilize Contract Opportunities according to Section J of FAR subsection 15.204-1 - Uniform contract format.,Requirement
isa0290000,ISA-29,"ISA-29 The system shall capture the funding plan for the requirement processing, including whether funds have been administratively reserved (i.e., committed).","The system shall capture the funding plan for the requirement processing, including whether funds have been administratively reserved (i.e., committed).",Requirement
isa0300000,ISA-30,ISA-30 The system shall flag the appropriate provisions/clauses to include the statement of funding contingency when funds are not expected to be available by the planned issuance date of the solicitation.,The system shall flag the appropriate provisions/clauses to include the statement of funding contingency when funds are not expected to be available by the planned issuance date of the solicitation.,Requirement
isa0310000,ISA-31,ISA-31 The system shall flag the appropriate provisions/clauses to include the statement of funding contingency when funds have not been committed according to Section I of FAR subsection 15.204-1 - Uniform contract format.,The system shall flag the appropriate provisions/clauses to include the statement of funding contingency when funds have not been committed according to Section I of FAR subsection 15.204-1 - Uniform contract format.,Requirement
isa0320000,ISA-32,ISA-32 The system shall maintain solicitation mailing lists to include the solicitation number.,The system shall maintain solicitation mailing lists to include the solicitation number.,Requirement
